{
  "$schema": "https://json-schema.org/draft/2020-12/schema",
  "$id": "https://veritas-os.example/schemas/reviewer_handoff_review_result_report_validation_report.schema.json",
  "title": "Reviewer Handoff Review Result Report Validation Report",
  "description": "Machine-readable report contract emitted by veritas-evidence-bundle validate-review-result-report --json. This schema validates only the validator result shape for a saved validate-review-result --json report. It does not re-run reviewer review, create trust, replace out-of-band public key trust, prove regulatory certification, complete third-party audit approval, or establish cryptographic truth. The report intentionally exposes booleans, fixed schema identifiers, and fixed diagnostics only; it does not expose raw file paths, raw JSON values, raw fingerprints, exception text, raw schema validator messages, secrets, or customer data from the saved report.",
  "type": "object",
  "additionalProperties": false,
  "required": [
    "ok",
    "result_schema_valid",
    "forbidden_patterns_absent",
    "validated_schema_id",
    "report_schema_id",
    "validator",
    "errors"
  ],
  "properties": {
    "ok": {
      "type": "boolean",
      "description": "Overall validate-review-result-report status. True means the saved validate-review-result --json report conformed to its JSON Schema and contained no forbidden sensitive or raw text patterns."
    },
    "result_schema_valid": {
      "type": "boolean",
      "description": "True when the saved validate-review-result --json report conforms to the reviewer handoff review result validation report schema."
    },
    "forbidden_patterns_absent": {
      "type": "boolean",
      "description": "True when the saved validate-review-result --json report does not contain forbidden sensitive or raw diagnostic patterns."
    },
    "validated_schema_id": {
      "type": "string",
      "const": "https://veritas-os.example/schemas/reviewer_handoff_review_result_validation_report.schema.json",
      "description": "Identifies the saved validate-review-result --json report schema checked by validate-review-result-report."
    },
    "report_schema_id": {
      "type": "string",
      "const": "https://veritas-os.example/schemas/reviewer_handoff_review_result_report_validation_report.schema.json",
      "description": "Identifies this validator result schema. This metadata validates report shape only; it does not re-run reviewer review or establish trust."
    },
    "validator": {
      "type": "string",
      "const": "veritas-evidence-bundle validate-review-result-report",
      "description": "Identifies the validator command that emitted this report."
    },
    "errors": {
      "type": "array",
      "description": "Fixed public diagnostics for failed saved-report checks. Empty when ok is true.",
      "items": {
        "type": "object",
        "additionalProperties": false,
        "required": [
          "check",
          "path",
          "message"
        ],
        "properties": {
          "check": {
            "type": "string",
            "enum": [
              "result_readable",
              "result_json_valid",
              "result_schema_valid",
              "forbidden_patterns_absent"
            ],
            "description": "Fixed saved-report check that failed."
          },
          "path": {
            "type": "string",
            "enum": [
              "$"
            ],
            "description": "Fixed public JSONPath-like location for the failed check."
          },
          "message": {
            "type": "string",
            "enum": [
              "result file could not be read",
              "result file is not valid JSON",
              "result does not satisfy schema",
              "result contains forbidden sensitive or raw text"
            ],
            "description": "Fixed public diagnostic. Raw external values, raw file paths, raw fingerprints, exception text, raw schema validator messages, secrets, customer data, and raw JSON values are not permitted."
          }
        }
      }
    }
  }
}
